{
  "paper_id": "P771b3315be036df7",
  "source_sha256": "771b3315be036df72a769a4f927fb115c13f91d11880bf148899442ba327a570",
  "metadata": {
    "title": "A Synthetic Study of Checklist-Assisted Review",
    "authors": [
      "Deep Paper Reader synthetic fixture"
    ],
    "year": null,
    "doi": "",
    "venue": "",
    "source": "pdf_metadata_unverified"
  },
  "pages": [
    {
      "page": 1,
      "width": 612.0,
      "height": 792.0,
      "rotation": 0,
      "text": "SYNTHETIC DEMO - invented study and numbers for software testing only.\n\nIntroduction\n\nA Synthetic Study of Checklist-Assisted Review\n\n\nReviewers inspect short reports to identify reporting omissions.\n\nThis demonstration examines whether a checklist improves omission detection.\n\nRQ1: Does checklist access increase the number of omissions detected?\n\nThe aim was to compare checklist-assisted review with unaided review.\n\nStudy Design\n\nTwelve volunteer graduate students were recruited through a campus email.\n\nParticipants were randomly assigned to two groups of six in a between-subjects design.\n\nBoth groups reviewed the same two-page report for 15 minutes and listed omissions.\n\nThe checklist group received a printed checklist; the control group reviewed without it.\n\n\n\n\n\n                                                                                                     1 / 3",
      "image_path": "pages/page-0001.png"
    },
    {
      "page": 2,
      "width": 612.0,
      "height": 792.0,
      "rotation": 0,
      "text": "SYNTHETIC DEMO - invented study and numbers for software testing only.\n\nMethods\n\n\nParticipants gave consent, received a two-minute tutorial, completed the task, then\nrated confidence.\n\nThis synthetic demonstration involved no real human participants.\n\nThe interface recorded each submitted omission and its timestamp during the task.\n\nAfter the task, participants rated confidence on a scale from 1 to 5.\n\nFor each participant, duplicate omission labels were removed and remaining labels were\ncounted.\n\nWe compared omission counts between groups using a two-sided Mann-Whitney U test.\n\n\nTable 1. Data sources and collection times in the synthetic study.\n\nData                                       Collected when                    Unit\n\nOmission log                                During task                       Submission\n\nConfidence rating                                 After task                              Participant\n\n\n\n\n\n                                                                                                     2 / 3",
      "image_path": "pages/page-0002.png"
    },
    {
      "page": 3,
      "width": 612.0,
      "height": 792.0,
      "rotation": 0,
      "text": "SYNTHETIC DEMO - invented study and numbers for software testing only.\n\nResults\n\n\nMedian omission counts were 8 for checklist and 5 for control; U = 5, p = 0.041.\n\nThe checklist group detected more omissions than the control group in this task.\n\n\n\n\n\n Median omission count\n\n\n      8\n\n\n      6\n\n\n      4\n\n\n      2\n\n\n      0\n                       Checklist                         Control\n\nFigure 1. Median omission counts by condition. Bars encode medians; no error bars are\nshown.\n\nDiscussion\n\nThe authors interpret this pattern as possible support for structured review aids.\n\nThis demonstration illustrates a traceable workflow for evaluating a review checklist.\n\nThe small sample and single report limit generalization.\n\n\n\n\n\n                                                                                                     3 / 3",
      "image_path": "pages/page-0003.png"
    }
  ],
  "sections": [
    {
      "section_id": "S001",
      "title": "Introduction",
      "page": 1,
      "block_id": "B00002",
      "detection": "heuristic"
    },
    {
      "section_id": "S002",
      "title": "Study Design",
      "page": 1,
      "block_id": "B00008",
      "detection": "heuristic"
    },
    {
      "section_id": "S003",
      "title": "Methods",
      "page": 2,
      "block_id": "B00015",
      "detection": "heuristic"
    },
    {
      "section_id": "S004",
      "title": "Results",
      "page": 3,
      "block_id": "B00028",
      "detection": "heuristic"
    },
    {
      "section_id": "S005",
      "title": "Discussion",
      "page": 3,
      "block_id": "B00039",
      "detection": "heuristic"
    }
  ],
  "blocks": [
    {
      "block_id": "B00001",
      "page": 1,
      "text": "SYNTHETIC DEMO - invented study and numbers for software testing only.",
      "bbox": [
        44.0,
        22.325000762939453,
        345.6080017089844,
        34.691001892089844
      ]
    },
    {
      "block_id": "B00002",
      "page": 1,
      "text": "Introduction",
      "bbox": [
        44.0,
        55.94999694824219,
        131.49501037597656,
        76.6050033569336
      ]
    },
    {
      "block_id": "B00003",
      "page": 1,
      "text": "A Synthetic Study of Checklist-Assisted Review",
      "bbox": [
        44.0,
        94.87999725341797,
        407.6479797363281,
        116.91200256347656
      ]
    },
    {
      "block_id": "B00004",
      "page": 1,
      "text": "Reviewers inspect short reports to identify reporting omissions.",
      "bbox": [
        44.0,
        142.1750030517578,
        349.65692138671875,
        157.28900146484375
      ]
    },
    {
      "block_id": "B00005",
      "page": 1,
      "text": "This demonstration examines whether a checklist improves omission detection.",
      "bbox": [
        44.0,
        176.1750030517578,
        429.1319274902344,
        191.28900146484375
      ]
    },
    {
      "block_id": "B00006",
      "page": 1,
      "text": "RQ1: Does checklist access increase the number of omissions detected?",
      "bbox": [
        44.0,
        210.1750030517578,
        399.80596923828125,
        225.28900146484375
      ]
    },
    {
      "block_id": "B00007",
      "page": 1,
      "text": "The aim was to compare checklist-assisted review with unaided review.",
      "bbox": [
        44.0,
        244.1750030517578,
        391.21490478515625,
        259.28900146484375
      ]
    },
    {
      "block_id": "B00008",
      "page": 1,
      "text": "Study Design",
      "bbox": [
        44.0,
        273.95001220703125,
        139.85000610351562,
        294.6050109863281
      ]
    },
    {
      "block_id": "B00009",
      "page": 1,
      "text": "Twelve volunteer graduate students were recruited through a campus email.",
      "bbox": [
        44.0,
        308.17498779296875,
        414.4909362792969,
        323.28900146484375
      ]
    },
    {
      "block_id": "B00010",
      "page": 1,
      "text": "Participants were randomly assigned to two groups of six in a between-subjects design.",
      "bbox": [
        44.0,
        342.17498779296875,
        469.5129699707031,
        357.28900146484375
      ]
    },
    {
      "block_id": "B00011",
      "page": 1,
      "text": "Both groups reviewed the same two-page report for 15 minutes and listed omissions.",
      "bbox": [
        44.0,
        376.17498779296875,
        456.67596435546875,
        391.28900146484375
      ]
    },
    {
      "block_id": "B00012",
      "page": 1,
      "text": "The checklist group received a printed checklist; the control group reviewed without it.",
      "bbox": [
        44.0,
        410.17498779296875,
        460.3389587402344,
        425.28900146484375
      ]
    },
    {
      "block_id": "B00013",
      "page": 1,
      "text": "1 / 3",
      "bbox": [
        550.4860229492188,
        756.3250122070312,
        568.0001220703125,
        768.6909790039062
      ]
    },
    {
      "block_id": "B00014",
      "page": 2,
      "text": "SYNTHETIC DEMO - invented study and numbers for software testing only.",
      "bbox": [
        44.0,
        22.325000762939453,
        345.6080017089844,
        34.691001892089844
      ]
    },
    {
      "block_id": "B00015",
      "page": 2,
      "text": "Methods",
      "bbox": [
        44.0,
        55.94999694824219,
        105.6650161743164,
        76.6050033569336
      ]
    },
    {
      "block_id": "B00016",
      "page": 2,
      "text": "Participants gave consent, received a two-minute tutorial, completed the task, then\nrated confidence.",
      "bbox": [
        44.0,
        100.17500305175781,
        445.6870422363281,
        131.28900146484375
      ]
    },
    {
      "block_id": "B00017",
      "page": 2,
      "text": "This synthetic demonstration involved no real human participants.",
      "bbox": [
        44.0,
        150.1750030517578,
        363.1319274902344,
        165.28900146484375
      ]
    },
    {
      "block_id": "B00018",
      "page": 2,
      "text": "The interface recorded each submitted omission and its timestamp during the task.",
      "bbox": [
        44.0,
        184.1750030517578,
        446.281005859375,
        199.28900146484375
      ]
    },
    {
      "block_id": "B00019",
      "page": 2,
      "text": "After the task, participants rated confidence on a scale from 1 to 5.",
      "bbox": [
        44.0,
        218.1750030517578,
        367.44403076171875,
        233.28900146484375
      ]
    },
    {
      "block_id": "B00020",
      "page": 2,
      "text": "For each participant, duplicate omission labels were removed and remaining labels were\ncounted.",
      "bbox": [
        44.0,
        252.1750030517578,
        473.7698669433594,
        283.28900146484375
      ]
    },
    {
      "block_id": "B00021",
      "page": 2,
      "text": "We compared omission counts between groups using a two-sided Mann-Whitney U test.",
      "bbox": [
        44.0,
        302.17498779296875,
        473.16497802734375,
        317.28900146484375
      ]
    },
    {
      "block_id": "B00022",
      "page": 2,